{
  "schema_version": "1.0.0",
  "purpose": "Non-admission discovery registry of volcanic-hazard sources relevant to catastrophe risk, event validation and secondary atmospheric impacts.",
  "review_date": "2026-08-10",
  "entries": [
    {
      "candidate_id": "iavcei.wovodat.v2",
      "name": "WOVOdat Database of Volcanic Unrest v2",
      "provider": "World Organization of Volcano Observatories / IAVCEI, hosted by Earth Observatory of Singapore",
      "categories": [
        "volcano",
        "volcanic_unrest",
        "seismicity",
        "deformation",
        "gas_emissions",
        "monitoring"
      ],
      "spatial_scope": "global contributions from volcano observatories and research institutions",
      "temporal_scope": "event- and station-dependent historical and modern unrest records",
      "resolution_or_granularity": "station, network and episode data organized by measured parameters under the WOVOdat 2.0 schema",
      "potential_roles": [
        "eruption_precursor_research",
        "unrest_analogue_analysis",
        "monitoring_feature_validation"
      ],
      "authoritative_url": "https://www.wovodat.org/doc/",
      "access_class_hint": "public_web_with_contributor_use_policy",
      "candidate_status": "evidence_checked",
      "rights_review_status": "not_reviewed",
      "scientific_review_status": "not_reviewed",
      "admission_status": "not_admitted",
      "note": "Coverage and measurement semantics are heterogeneous across observatories, stations and episodes. WOVOdat's published policy attributes ownership to original contributors, restricts redistribution and frames free use around crisis response, education and research; this candidate therefore requires especially careful rights review before any commercial or redistributed use."
    },
    {
      "candidate_id": "copernicus.s5p.tropomi.so2.l2",
      "name": "Copernicus Sentinel-5P TROPOMI Level-2 Sulfur Dioxide",
      "provider": "Copernicus Sentinel-5P / ESA",
      "categories": [
        "volcano",
        "sulfur_dioxide",
        "satellite_observation",
        "atmospheric_plume",
        "secondary_peril"
      ],
      "spatial_scope": "global",
      "temporal_scope": "April 2018-present for the non-time-critical Level-2 archive",
      "resolution_or_granularity": "orbit/granule-based Level-2 total-column SO2 retrievals with product-version-dependent pixel geometry, quality fields and processing",
      "potential_roles": [
        "volcanic_plume_detection",
        "eruption_footprint_validation",
        "so2_burden_context",
        "event_timing_cross_check"
      ],
      "authoritative_url": "https://dataspace.copernicus.eu/data-collections/copernicus-sentinel-missions/sentinel-5p",
      "access_class_hint": "copernicus_data_space",
      "candidate_status": "evidence_checked",
      "rights_review_status": "not_reviewed",
      "scientific_review_status": "not_reviewed",
      "admission_status": "not_admitted",
      "note": "SO2 is a retrieved atmospheric column rather than a direct ash or damage observation, and non-volcanic sources also contribute. Processor and collection changes are scientifically material: the mission-wide SO2 reprocessing completed in 2025 superseded older products for much of the archive, so exact product class, collection, processor version and quality filtering must be frozen before comparison."
    },
    {
      "candidate_id": "noaa.ncei.significant-volcanic-eruptions",
      "name": "NCEI/WDS Global Significant Volcanic Eruptions Database",
      "provider": "NOAA National Centers for Environmental Information / World Data Service",
      "categories": [
        "volcano",
        "eruption_catalogue",
        "historical_impact",
        "damage",
        "casualties",
        "validation"
      ],
      "spatial_scope": "global",
      "temporal_scope": "4360 BC-present",
      "resolution_or_granularity": "eruption-event records with hazard, location, VEI and available socio-economic impact attributes",
      "potential_roles": [
        "historical_impact_validation",
        "catastrophe_event_benchmark",
        "cross_peril_event_linkage",
        "severity_context"
      ],
      "authoritative_url": "https://www.ncei.noaa.gov/access/metadata/landing-page/bin/iso?id=gov.noaa.ngdc.mgg.hazards%3AG10147",
      "access_class_hint": "public_metadata_and_download",
      "candidate_status": "evidence_checked",
      "rights_review_status": "not_reviewed",
      "scientific_review_status": "not_reviewed",
      "admission_status": "not_admitted",
      "note": "This is deliberately a significance-selected impact catalogue, not a complete eruption-frequency catalogue. Inclusion criteria favor fatalities, damage, VEI 6+ events and eruptions associated with tsunamis or significant earthquakes, so sampling and reporting biases must be preserved when using it for model validation."
    }
  ]
}
