{
  "schema_version": "1.0.0",
  "purpose": "Non-admission discovery registry of vulnerability, fragility and loss-function sources relevant to catastrophe-risk model benchmarking.",
  "review_date": "2026-08-10",
  "entries": [
    {
      "candidate_id": "gem.global-seismic-vulnerability-model.v2026.0.0",
      "name": "GEM Global Seismic Vulnerability Model v2026.0.0",
      "provider": "Global Earthquake Model (GEM) Foundation",
      "categories": [
        "earthquake",
        "vulnerability",
        "fragility",
        "loss_functions",
        "risk_model_benchmark"
      ],
      "spatial_scope": "global model family with region-country/territory vulnerability sets; applicability remains conditional on supported GEM building-taxonomy attributes",
      "temporal_scope": "versioned v2026.0.0 dataset release published 2026-06-17",
      "resolution_or_granularity": "country/territory XML vulnerability-function sets for building typologies, with structural, non-structural, contents and fatality consequence functions",
      "potential_roles": [
        "seismic_vulnerability_benchmark",
        "fragility_function_reference",
        "loss_function_sensitivity_analysis",
        "taxonomy_interoperability_check"
      ],
      "authoritative_url": "https://doi.org/10.5281/zenodo.20730225",
      "access_class_hint": "public_download_noncommercial_sharealike",
      "candidate_status": "evidence_checked",
      "rights_review_status": "not_reviewed",
      "scientific_review_status": "not_reviewed",
      "admission_status": "not_admitted",
      "note": "GEM distributes the open model under CC BY-NC-SA 4.0 and requires a separate licence for commercial use. The functions are model-derived vulnerability/fragility evidence, not observed post-event loss truth; taxonomy/intensity-measure applicability and uncertainty must be preserved. The repository already admits ESRM20 vulnerability v1.1 metadata, so any future comparison must treat GEM v2026 as a distinct model benchmark rather than statistically independent empirical validation or a drop-in replacement."
    }
  ]
}
