{
  "schema_version": "1.0.0",
  "purpose": "Non-admission discovery registry of wildfire-hazard observation, burned-area and fire-weather sources relevant to catastrophe risk and scientific validation.",
  "review_date": "2026-08-10",
  "entries": [
    {
      "candidate_id": "ec.jrc.gwis.fire-danger-forecast",
      "name": "JRC Global Wildfire Information System Fire Danger Forecast",
      "provider": "European Commission Joint Research Centre / Global Wildfire Information System",
      "categories": [
        "wildfire",
        "fire_weather",
        "fire_danger",
        "forecast",
        "hazard_context"
      ],
      "spatial_scope": "global",
      "temporal_scope": "operational deterministic fire-danger forecasts with FWI anomaly and ranking context derived against an approximately 40-year historical series; exact forecast cycle and archive must be pinned for reproducible use",
      "resolution_or_granularity": "model-dependent Fire Weather Index and component fields from deterministic ECMWF approximately 8 km, MeteoFrance approximately 10 km and NASA GEOS-5 approximately 28 km numerical weather forecasts",
      "potential_roles": [
        "fire_weather_conditioning",
        "hazard_severity_context",
        "forecast_skill_research",
        "event_environment_validation"
      ],
      "authoritative_url": "https://gwis.jrc.ec.europa.eu/about-gwis/technical-background/fire-danger-forecast",
      "access_class_hint": "public_gwis_maps_and_data_services",
      "candidate_status": "evidence_checked",
      "rights_review_status": "not_reviewed",
      "scientific_review_status": "not_reviewed",
      "admission_status": "not_admitted",
      "note": "GWIS FWI is model-driven meteorological fire-danger information, not an observed ignition, burned-area probability or loss field. Forecast source and resolution differ by numerical weather model, and the globally harmonized danger classes plus anomaly/ranking transformations are part of the scientific contract; exact model, cycle, lead time and index definition must be preserved."
    }
  ]
}
