{
  "schema_version": "1.0.0",
  "purpose": "Non-admission discovery of Japan building geometry, semantic 3D city attributes and seismic hazard context for future catastrophe exposure and hazard research; no source rights or scientific model admission.",
  "review_date": "2026-11-01",
  "entries": [
    {
      "candidate_id": "jp.mlit.plateau.citygml.3d-city-models",
      "name": "Japan MLIT PLATEAU municipal 3D city models (CityGML)",
      "provider": "Japan Ministry of Land, Infrastructure, Transport and Tourism (MLIT) / municipal publishers",
      "categories": [
        "buildings",
        "building_geometry_3d",
        "building_attributes",
        "japan",
        "exposure_context"
      ],
      "spatial_scope": "Japan; municipality-dependent coverage, not a complete national building census",
      "temporal_scope": "Municipal CityGML vintages and revisions differ; exact municipality, edition and source acquisition date required",
      "resolution_or_granularity": "CityGML building objects with varying LoD and optional measured height, floors, use and construction-year attributes; availability varies by city and object",
      "potential_roles": [
        "building_footprint_attribute_crosswalk",
        "building_height_vulnerability_prior",
        "urban_building_exposure_validation"
      ],
      "authoritative_url": "https://www.mlit.go.jp/plateau/en/",
      "access_class_hint": "official_citygml_catalogue_metadata_first_city_specific_licence_and_api_terms_review",
      "candidate_status": "evidence_checked",
      "rights_review_status": "not_reviewed",
      "scientific_review_status": "not_reviewed",
      "admission_status": "not_admitted",
      "note": "MLIT publishes open CityGML models and describes multiple permissive licence families, but exact city/edition, municipal attribution and service-specific API terms require separate review. PLATEAU's experimental CityGML API has no guaranteed stable schema or service level. LoD1 heights may be abstracted; polygon, measured height, usage and construction year are not complete, independent or insured asset records."
    },
    {
      "candidate_id": "jp.gsi.fgd.building-outline.gml",
      "name": "Japan GSI Fundamental Geospatial Data basic items: building outlines",
      "provider": "Geospatial Information Authority of Japan (GSI)",
      "categories": [
        "buildings",
        "building_footprints",
        "authoritative_mapping",
        "japan",
        "geometry_validation"
      ],
      "spatial_scope": "Japan; coverage and revision dates depend on mesh and production area",
      "temporal_scope": "Continuously revised Fundamental Geospatial Data basic items; exact mesh file and creation date must be frozen",
      "resolution_or_granularity": "JPGIS/GML basic mapping items including building exterior lines, without inferred roof type or insured valuation",
      "potential_roles": [
        "plateau_building_outline_comparison",
        "building_geometry_source_crosscheck",
        "geospatial_registration_audit"
      ],
      "authoritative_url": "https://service.gsi.go.jp/kiban/",
      "access_class_hint": "free_user_registration_required_survey_act_and_reuse_permissions_check_no_anonymous_bulk_probe",
      "candidate_status": "evidence_checked",
      "rights_review_status": "not_reviewed",
      "scientific_review_status": "not_reviewed",
      "admission_status": "not_admitted",
      "note": "GSI requires free user registration for download and warns that Survey Act reproduction/use applications may be required. Do not automate credentialed access, mirror source bytes or assert open redistribution. Native exterior-line features are not identical to PLATEAU building objects: align vintage, map-sheet coverage, CRS and topology before any many-to-many matching."
    },
    {
      "candidate_id": "jp.nied.jshis.pshm.site-amplification",
      "name": "Japan NIED J-SHIS probabilistic seismic hazard and site amplification",
      "provider": "National Research Institute for Earth Science and Disaster Resilience (NIED) / J-SHIS",
      "categories": [
        "earthquake",
        "seismic_hazard",
        "site_amplification",
        "japan",
        "hazard_context"
      ],
      "spatial_scope": "Japan national hazard-map and subsurface grids with release-specific regional coverage",
      "temporal_scope": "J-SHIS map products are released by version/scenario; preserve version, reference epoch, probability window and model assumptions",
      "resolution_or_granularity": "Probabilistic shaking exceedance maps and curves (CSV/Shapefile/KML) and site amplification factors; grid and parameters differ by product",
      "potential_roles": [
        "seismic_hazard_grid_crosswalk",
        "building_site_condition_prior",
        "hazard_model_consistency_challenge"
      ],
      "authoritative_url": "https://www.j-shis.bosai.go.jp/en/downloads",
      "access_class_hint": "public_download_page_terms_and_version_scoped_rights_review_before_file_acquisition",
      "candidate_status": "evidence_checked",
      "rights_review_status": "not_reviewed",
      "scientific_review_status": "not_reviewed",
      "admission_status": "not_admitted",
      "note": "A J-SHIS probability of exceedance over a specified period is not a recorded event intensity, building fragility, earthquake damage, or insured loss. Site amplification is a separate geophysical quantity with individual citation obligations. Rights, exact map release, hazard measure/unit, mesh CRS and possible shared source-model lineage need independent review."
    }
  ]
}
